<?xml version="1.0" encoding="UTF-8"?>
<list isChanceMultisell="false" xmlns:xsi="http://www.w3.org/2001/XMLSchema-instance" xsi:noNamespaceSchemaLocation="../xsd/multisell.xsd">
	<npcs>
		<npc>30254</npc> <!-- Harmony -->
	</npcs>
	<item>
		<ingredient id="90045" count="31" /> <!-- Magical Tablet --> 
		<ingredient id="57" count="100000" /> <!-- Adena --> 
		<production id="91483" count="1" /> <!-- Scroll: Bind --> 
	</item>
	<item>
		<ingredient id="90045" count="31" /> <!-- Magical Tablet --> 
		<ingredient id="57" count="100000" /> <!-- Adena --> 
		<production id="90089" count="1" /> <!-- Scroll: Vampiric Mist --> 
	</item>
	<item>
		<ingredient id="90045" count="31" /> <!-- Magical Tablet --> 
		<ingredient id="57" count="100000" /> <!-- Adena --> 
		<production id="90083" count="1" /> <!-- Scroll: Ice Vortex Crusher --> 
	</item>
	<item>
		<ingredient id="90045" count="31" /> <!-- Magical Tablet --> 
		<ingredient id="57" count="100000" /> <!-- Adena --> 
		<production id="90086" count="1" /> <!-- Scroll: Arcane Shield --> 
	</item>
	<item>
		<ingredient id="90045" count="31" /> <!-- Magical Tablet --> 
		<ingredient id="57" count="100000" /> <!-- Adena --> 
		<production id="90085" count="1" /> <!-- Scroll: Arcane Chaos --> 
	</item>
	<item>
		<ingredient id="90045" count="31" /> <!-- Magical Tablet --> 
		<ingredient id="57" count="100000" /> <!-- Adena --> 
		<production id="90081" count="1" /> <!-- Scroll: Arcane Power --> 
	</item>
	<item>
		<ingredient id="90045" count="31" /> <!-- Magical Tablet --> 
		<ingredient id="57" count="100000" /> <!-- Adena --> 
		<production id="90084" count="1" /> <!-- Scroll: Wind Vortex Slug --> 
	</item>
	<item>
		<ingredient id="90045" count="31" /> <!-- Magical Tablet --> 
		<ingredient id="57" count="100000" /> <!-- Adena --> 
		<production id="90087" count="1" /> <!-- Scroll: Curse of Doom --> 
	</item>
	
	<item>
		<ingredient id="90045" count="31" /> <!-- Magical Tablet --> 
		<ingredient id="57" count="100000" /> <!-- Adena --> 
		<production id="90088" count="1" /> <!-- Scroll: Curse of Abyss --> 
	</item>
	<item>
		<ingredient id="90045" count="31" /> <!-- Magical Tablet --> 
		<ingredient id="57" count="100000" /> <!-- Adena --> 
		<production id="90082" count="1" /> <!-- Scroll: Fire Vortex Buster --> 
	</item>
</list>