<?xml version="1.0" encoding="UTF-8"?>
<list xmlns:xsi="http://www.w3.org/2001/XMLSchema-instance" xsi:noNamespaceSchemaLocation="../xsd/multisell.xsd">
	<npcs>
		<npc>32478</npc> <!-- Dimensional Manager -->
	</npcs>
	<item>
		<!-- Immortal Armor Set Coupon -->
		<ingredient count="1" id="27526" />
		<!-- Immortal Armor Heavy Set --> 
	    <!-- Official not work! isn't confirmed -->
		<production count="1" id="17304" />
		<production count="1" id="17305" />
		<production count="1" id="17306" />
		<production count="1" id="17307" />
		<production count="1" id="17308" />
	</item>
</list>
