<?xml version="1.0" encoding="UTF-8"?>
<list xmlns:xsi="http://www.w3.org/2001/XMLSchema-instance" xsi:noNamespaceSchemaLocation="../../xsd/multisell.xsd">
	<item>
		<ingredient id="57" count="10000000"/>
		<production id="1419" count="1"/>
	</item>
	<item>
		<ingredient id="57" count="20000000"/>
		<production id="3874" count="1"/>
	</item>
	<item>
		<ingredient id="57" count="40000000"/>
		<production id="3870" count="1"/>
	</item>
	<item>
		<ingredient id="57" count="1"/>
		<production id="4295" count="1"/>
	</item>
	<item>
		<ingredient id="57" count="1"/>
		<production id="3865" count="1"/>
	</item>
	<item>
		<ingredient id="57" count="8000000"/>
		<production id="8056" count="1"/>
	</item>
	<item>
		<ingredient id="57" count="10000"/>
		<production id="7609" count="1"/>
	</item>
	<item>
		<ingredient id="57" count="50000"/>
		<production id="7256" count="1"/>
	</item>
	<item>
		<ingredient id="57" count="50000"/>
		<production id="7257" count="1"/>
	</item>
	<item>
		<ingredient id="57" count="50000"/>
		<production id="7258" count="1"/>
	</item>
	<item>
		<ingredient id="57" count="50000"/>
		<production id="7259" count="1"/>
	</item>
	<item>
		<ingredient id="57" count="100000"/>
		<production id="8073" count="1"/>
	</item>
	<item>
		<ingredient id="57" count="100000"/>
		<production id="7215" count="1"/>
	</item>
	<item>
		<ingredient id="57" count="100000"/>
		<production id="7225" count="1"/>
	</item>
	<item>
		<ingredient id="57" count="100000"/>
		<production id="7243" count="1"/>
	</item>
	<item>
		<ingredient id="57" count="100000"/>
		<production id="7219" count="1"/>
	</item>
	<item>
		<ingredient id="57" count="100000"/>
		<production id="7267" count="1"/>
	</item>
	<item>
		<ingredient id="57" count="25"/>
		<production id="15307" count="1"/>
	</item>
	<item>
		<ingredient id="57" count="25"/>
		<production id="15308" count="1"/>
	</item>
	<item>
		<ingredient id="57" count="25"/>
		<production id="15309" count="1"/>
	</item>
	<item>
		<ingredient id="57" count="500000"/>
		<production id="9714" count="1"/>
	</item>
	<item>
		<ingredient id="57" count="500000"/>
		<production id="9687" count="1"/>
	</item>
	<item>
		<ingredient id="57" count="500000"/>
		<production id="9686" count="1"/>
	</item>
	<item>
		<ingredient id="57" count="500000"/>
		<production id="9685" count="1"/>
	</item>
	<item>
		<ingredient id="57" count="500000"/>
		<production id="9691" count="1"/>
	</item>
	<item>
		<ingredient id="57" count="500000"/>
		<production id="9690" count="1"/>
	</item>
	<item>
		<ingredient id="57" count="100000"/>
		<production id="8275" count="1"/>
	</item>
	<item>
		<ingredient id="57" count="100000"/>
		<production id="8056" count="1"/>
	</item>
</list>